{"$schema":"https://json-schema.org/draft/2020-12/schema","type":"object","additionalProperties":false,"required":["$schema","npmRegistry","officialHosts","packageName","repository","tagPattern","allowRedirects"],"properties":{"$schema":{"const":"../schemas/trusted-sources.schema.json"},"npmRegistry":{"const":"https://registry.npmjs.org/"},"officialHosts":{"type":"array","minItems":3,"uniqueItems":true,"items":{"enum":["registry.npmjs.org","github.com","raw.githubusercontent.com"]}},"packageName":{"const":"@deepseek-ai/dsh"},"repository":{"const":"deepseek-ai/deepseek-harness"},"tagPattern":{"const":"^dsh-v0\\.1\\.1-rc\\.2$"},"allowRedirects":{"const":false}}}
